concept,concept_type,length,data_key,data_type,description
MEDS5_02_18,measure,0.0,,,Registration fee generic pharmaceutical product
MEDS5_03_01,measure,0.0,,,Legal provisions for the appointment of government pharmaceutical officials
MEDS5_03_02,measure,0.0,,,Inspectors are allowed to inspect premises where pharmaceutical activities are performed
MEDS5_03_03_01,measure,0.0,,,Inspection a pre-requisite for licensing of: Public
MEDS5_03_03_02,measure,0.0,,,Inspection a pre-requisite for licensing of: Private
MEDS5_03_04,measure,0.0,,,Inspection requirements the same for public and private facilities
MEDS5_03_05_01,measure,0.0,,,Local manufacturers - GMP compliance
MEDS5_03_05_02,measure,0.0,,,Private Wholesalers
MEDS5_03_05_03,measure,0.0,,,Retail distributors
MEDS5_03_05_04,measure,0.0,,,Public pharmacies and stores
MEDS5_03_05_05,measure,0.0,,,Pharmacies and dispensing points of health facilities
MEDS5_04_01,measure,0.0,,,Authorization to import medicines required
MEDS5_04_02,measure,0.0,,,Sampling of imported products for testing permitted
MEDS5_04_03,measure,0.0,,,Importation of medicines through authorized ports of entry
MEDS5_04_04,measure,0.0,,,Inspection of pharmaceutical products at authorized ports of entry permitted
MEDS5_05_02,measure,0.0,,,Pharmaceutical manufacturers must comply good manufacturing practices
MEDS5_05_01,measure,0.0,,,Licensing required for: Manufacturers
MEDS5_05_04,measure,0.0,,,Licensing required for: Importers
MEDS5_05_05,measure,0.0,,,Licensing required for: Wholesalers
MEDS5_05_09,measure,0.0,,,Licensing private pharmacies obligatory
MEDS5_05_10,measure,0.0,,,Licensing required for: public pharmacies
MEDS5_05_06,measure,0.0,,,Wholesalers and distributors to comply with Good Distribution Practices
MEDS5_05_08,measure,0.0,,,Pharmacists to be registered
MEDS5_05_03,measure,0.0,,,Good Manufacturing Practices (GMP) published
MEDS5_05_07,measure,0.0,,,National Good Distribution Practice requirements published
MEDS5_05_11,measure,0.0,,,National Good Pharmacy Practice Guidelines published
MEDS5_05_12,measure,0.0,,,List of all licensed pharmaceutical facilities (publication legally required)
MEDS5_06_01,measure,0.0,,,Legislation supports Pharmaceutical market regulation
MEDS5_06_02,measure,0.0,,,Quality control testing laboratory is available
MEDS5_06_02_01,measure,0.0,,,Quality control laboratory is part of medication regulatory authority
MEDS5_06_02_02,measure,0.0,,,Testing services contracted out by regulatory authority
MEDS5_06_04_01,measure,0.0,,,For quality monitoring in public sector (pharmacy stores and health facilities)
MEDS5_06_04_02,measure,0.0,,,For quality monitoring in private sector (retail outlets)
MEDS5_06_04_03,measure,0.0,,,When there are complaints / problems
MEDS5_06_04_04,measure,0.0,,,For product registration
MEDS5_06_04_05,measure,0.0,,,For public procurement prequalification
MEDS5_06_04_06,measure,0.0,,,For public program products prior to acceptance and/or distribution
MEDS5_06_06,measure,0.0,,,Number of quality control samples tested in past two years
MEDS5_06_07,measure,0.0,,,Number of samples that failed the testing in two years
MEDS5_07_01,measure,0.0,,,Legal provisions control promoting and advertising of prescription medicine
MEDS5_07_03,measure,0.0,,,Ban on direct to consumer pharmaceutical advertising
MEDS5_07_04,measure,0.0,,,Pre-approval for medicines advertisements and promotional materials  required
MEDS5_07_05,measure,0.0,,,Guidelines for advertising and promotion of non-prescription medicines
MEDS5_07_06,measure,0.0,,,Code of conduct for advertising by MA holders exists and is publicly available
MEDS5_07_06_01,measure,0.0,,,Code of conduct applies to: Both
MEDS5_07_06_02,measure,0.0,,,Voluntary adherence to code
MEDS5_07_06_03,measure,0.0,,,Code contains formal process for complaints and sanctions
MEDS5_07_06_04,measure,0.0,,,Up to date list of complaints and sanctions publicly available
MEDS5_08_01,measure,0.0,,,Legal provisions exist requiring authorization for conducting clinical trials by the medical regulatory authority
MEDS5_08_02,measure,0.0,,,Clinical Trials require ethics committee/institutional review board approval
MEDS5_08_03,measure,0.0,,,Registration of clinical trials in international/national/regional registry
MEDS5_09_01_01,measure,0.0,,,"Single convention on narcotic drugs, 1961"
MEDS5_09_01_02,measure,0.0,,,"The 1972 protocol amending the single convention on narcotic drugs, 1961"
MEDS5_09_01_03,measure,0.0,,,"Convention on psychotropic substances, 1971"
MEDS5_09_01_04,measure,0.0,,,"United nations convention against the illicit traffic in narcotic drugs and psychotropic substances, 1988"
MEDS5_09_02,measure,0.0,,,"Laws for the control of narcotic and psychotropic substances, and precursors exist"
MEDS5_09_03,measure,0.0,,,Annual morphine consumption (mg/capita)
MEDS5_10_01,measure,0.0,,,PV activities legally established within MRA mandate
MEDS5_10_02,measure,0.0,,,MA holders required to continuously monitor safety of products and report to MRA
MEDS5_10_03,measure,0.0,,,Legal provisions for monitoring of ADR exist
MEDS5_10_04,measure,0.0,,,National pharmacovigilance center linked to the medicines regulatory authority
MEDS5_10_04_02,measure,0.0,,,Number of reports submitted in the last two years by the national pharmacovigilance center
MEDS5_10_04_03,measure,0.0,,,NPC publishes ADR bulletin
MEDS5_10_07,measure,0.0,,,No. of ADRs on database
MEDS5_10_08,measure,0.0,,,Number of reports of adverse drug reactions submitted in the last two years by the national pharmacovigilance center
MEDS5_10_09_01,measure,0.0,,,No. of ADRs submitted to Uppsala database
MEDS6_01_01_01,measure,0.0,,,Patients who cannot afford them received free medicines
MEDS6_01_01_02,measure,0.0,,,Children under 5 receive free medicines
MEDS6_01_01_03,measure,0.0,,,Pregnant women receive free medicines
MEDS6_01_01_04,measure,0.0,,,Elderly  received free medicines
MEDS6_01_02_01,measure,0.0,,,All essential medicines are free
MEDS6_01_02_02,measure,0.0,,,Free medicines for any non communicable diseases
MEDS6_01_02_03,measure,0.0,,,Free medicines for Malaria
MEDS6_01_02_04,measure,0.0,,,Free medicines for TB
MEDS6_01_02_05,measure,0.0,,,Free medicines for STD
MEDS6_01_02_06,measure,0.0,,,Free medicines for HIV
MEDS6_01_02_07,measure,0.0,,,Free vaccines for EPI
MEDS6_01_03,measure,0.0,,,National or social health insurance providing at least partial medicines coverage
MEDS6_01_03_01,measure,0.0,,,Providing medicines that are on the Essential Medicines List for inpatients
MEDS6_01_03_02,measure,0.0,,,Providing medicines that are on the Essential Medicines List for outpatients
MEDS6_01_04,measure,0.0,,,Private health insurance schemes provide medicines coverage
MEDS6_01_04_01,measure,0.0,,,Private health insurance provides coverage for medicines which are on the EML
MEDS6_02_01,measure,0.0,,,Co-payments/ fee requirements for consultations
MEDS6_02_02,measure,0.0,,,Co-payments/ fee requirements for medicines
MEDS6_03_01,measure,0.0,,,Medicine pricing regulations
MEDS6_03_01_01,measure,0.0,,,Pricing provisions aimed at: Manufacturers
MEDS6_03_01_02,measure,0.0,,,Pricing provisions aimed at: Wholesalers
MEDS6_03_01_03,measure,0.0,,,Pricing provisions aimed at: Retailers
MEDS6_06_01,measure,0.0,,,Duties on active pharmaceutical ingredients
MEDS6_06_02,measure,0.0,,,Duties on finished pharmaceutical products
MEDS6_06_03,measure,0.0,,,Value added taxes on pharmaceutical products
MEDS6_06_07,measure,0.0,,,Duty rate on active pharmaceutical ingredients
MEDS6_06_08,measure,0.0,,,Duty rate on finished pharmaceutical products
MEDS6_06_09,measure,0.0,,,Value added taxes rate
MEDS6_02_03,measure,0.0,,,Revenues from fees used to pay salaries of health workers
MEDS7_01_01_01,measure,0.0,,,Public sector procurement is decentralized
MEDS7_01_01_02,measure,0.0,,,Public sector procurement is decentralized and centralized
MEDS7_01_02_01,measure,0.0,,,Public sector procurement is the reponsibility of procurement agency that is part of MOH
MEDS7_01_02_02,measure,0.0,,,Public sector procurement is the reponsibility of procurement agency that is semi autonomous
MEDS7_01_02_03,measure,0.0,,,Public sector procurement is the reponsibility of procurement agency that is  autonomous
MEDS7_01_02_04,measure,0.0,,,A government procurement agency procures all public goods
MEDS7_01_03,measure,0.0,,,Public sector requests for tender documents are publicly available
MEDS7_01_04,measure,0.0,,,Public sector awards are publicly available
MEDS7_01_05,measure,0.0,,,Procurement is based on prequalification of suppliers
MEDS7_02_01,measure,0.0,,,The government supply system department has a central medical store
MEDS7_02_03,measure,0.0,,,There are national guidelines on Good Distribution Practices
MEDS7_02_04,measure,0.0,,,There is a licensing authority that issues GDP licenses
MEDS7_02_04_01,measure,0.0,,,The licensing authority accredits public distribution facilities
MEDS7_02_05,measure,0.0,,,A list of GDP certified warehouses in the public sector exists
MEDS7_02_06,measure,0.0,,,A list of GDP certified distributors in the public sector exists
MEDS7_02_09,measure,0.0,,,Availability of key medicines at the central medical store
MEDS7_03_01,measure,0.0,,,Legal provisions exist for licensing wholesales in private sector
MEDS7_03_02,measure,0.0,,,Legal provisions exist for licensing distributors in private sector
MEDS7_03_03,measure,0.0,,,A list of GDP certified wholsesalers in the private sector exists
MEDS7_03_04,measure,0.0,,,A list of GDP certified distributors in the private sector exists
MEDS8_02_08_01,measure,0.0,,,Core medical training includes: concept of EML
MEDS8_02_08_02,measure,0.0,,,Core medical training includes: Use for STGS
MEDS8_02_08_03,measure,0.0,,,Core medical training includes: Pharmacovigilance
MEDS8_02_08_04,measure,0.0,,,Core medical training includes: Problem based pharmacotherapy
MEDS8_02_09,measure,0.0,,,Mandatory continuing education that includes pharmaceutical issues is required for doctors
MEDS8_02_10,measure,0.0,,,Mandatory continuing education that includes pharmaceutical issues is required for nurses
MEDS8_02_11,measure,0.0,,,Mandatory continuing education that includes pharmaceutical issues is required for paramedical staff
MEDS8_02_12_01,measure,0.0,,,Public sector generic prescribing is obligatory
MEDS8_02_12_02,measure,0.0,,,Private sector generic prescribing is obligatory
MEDS8_03_02_01,measure,0.0,,,Core pharmacist training includes: EML
MEDS8_03_02_02,measure,0.0,,,Core pharmacist training includes: Use of  STG
MEDS8_03_02_03,measure,0.0,,,Core pharmacist training includes: drug information
MEDS8_03_02_04,measure,0.0,,,Core pharmacist training includes: clinical pharmacology
MEDS8_03_02_05,measure,0.0,,,Core pharmacist training includes: medicines supply management
MEDS8_03_04,measure,0.0,,,Generic substitution permitted in public sector
MEDS8_03_05,measure,0.0,,,Generic substitution permitted in private sector
MEDS8_03_06,measure,0.0,,,Antibiotics are sometimes sold OTC without prescription
MEDS8_03_07,measure,0.0,,,Injectables are sometimes sold OTC without prescription
MEDS8_01_08,measure,0.0,,,National medicines information center exists
MEDS8_01_09,measure,0.0,,,Public education campaigns on rational medicine use topics have been conducted in previous two years
MEDS8_01_10,measure,0.0,,,A survey on rational medicine use has been conducted in the previous two years
MEDS8_01_11,measure,0.0,,,A national committee exists to monitor and promote rational use of medicines
MEDS8_01_12,measure,0.0,,,National strategy to contain antimicrobial resistance exists
MEDS8_01_18,measure,0.0,,,Existence of a funded national intersectoral taskforce to coordinate the promotion of appropriate use of antimicrobials
MEDS8_01_19,measure,0.0,,,A national reference lab has responsibility for coordinating epidemiological surveillance of AMR
MEDS8_02_01,measure,0.0,,,Legal provisions exist to govern the licensing and prescribing practices of prescriber
MEDS8_02_02,measure,0.0,,,Legal provisions exist to restrict dispensing by prescribers
MEDS8_02_03,measure,0.0,,,Prescribers in the private sector dispense medicine
MEDS8_02_04,measure,0.0,,,Regulations require hospitals to organize/develop DTCs
MEDS8_02_05,measure,0.0,,,More than half of referral hospital have a DTC
MEDS8_02_06,measure,0.0,,,More than half of general hospitals have a DTC
MEDS8_02_07,measure,0.0,,,More than half of regions/provinces have a DTC
MEDS8_02_13,measure,0.0,,,Average number of medicines prescribed per patient contact in public health facilities
MEDS8_02_15,measure,0.0,,,Percentage of medicines in outpatient public health care facilities that are prescribed by INN name
MEDS8_02_16,measure,0.0,,,Percentage of patients in outpatient public health care facilities receiving antibiotics
MEDS8_02_17,measure,0.0,,,Percentage of patients in outpatient public health care facilities receiving injections
MEDS8_02_19,measure,0.0,,,Percentage of medicines adequately labelled in public health facilities
MEDS8_02_23,measure,0.0,,,Diarrhoea in children treated with ORS
MEDS8_03_10_01,measure,0.0,,,Nurses sometimes prescribe prescription-only medicines
MEDS8_03_10_02,measure,0.0,,,Pharmacists sometimes prescribe prescription-only medicines
MEDS8_03_10_03,measure,0.0,,,Paramedics sometimes prescribe prescription-only medicines
MEDS8_03_10_04,measure,0.0,,,Personnel with less than one month training sometimes prescribe prescription-only medicines
MEDS8_03_01,measure,0.0,,,Legal provisions exist to govern dispensing practices of pharmaceutical personnel
MEDS8_01_01_01,measure,0.0,,,Number of medicines on essential medicines list
MEDS8_01_01_02,measure,0.0,,,Written process for selecting medicines on the EML
MEDS8_01_01_03,measure,0.0,,,Written process is publicly available
MEDS8_01_01_04,measure,0.0,,,Mechanism to align EML and STG
MEDS8_01_02,measure,0.0,,,Standard treatment guidelines for common illnesses produced by the ministry of health
MEDS8_01_03,measure,0.0,,,STG specific to primary care exists
MEDS8_01_04,measure,0.0,,,STG specific to secondary care exists
MEDS8_01_05,measure,0.0,,,National standard treatment guidelines for children
MEDS8_01_06,measure,0.0,,,% of public health facilities with copy EML (mean)
MEDS8_01_07,measure,0.0,,,% of public health facilities with copy STG (mean)
MEDS8_01_14,measure,0.0,,,EML includes formulations specific for children
MEDS8_01_15,measure,0.0,,,There are explicitly documented criteria for the selection of medicines on the EML
MEDS8_01_16,measure,0.0,,,There is a formal committee for the selection of products on the EML
MEDS8_01_16_01,measure,0.0,,,Conflict of interest declarations are required from members of national EML committee
MEDS8_01_17,measure,0.0,,,National medicines formulary exists
MEDS8_02_14,measure,0.0,,,% of medicines prescribed in outpatient public health care facilities that are on the EML
MEDS8_03_03,measure,0.0,,,Mandatory continuing education that includes rational use of medicines is required for pharmacists
MORT_500,measure,237632.0,unknow,number,Number of deaths
MORT_400,measure,165900.0,unknow,number,Deaths per 100 000 population
CCO_1,measure,105.0,country,number,Poverty headcount ratio at $1.25 a day (PPP) (% of population)
CCO_2,measure,369.0,country,number,Human development index rank
CCO_3,measure,333.0,country,number,Gender inequality index rank
MEDS2_01_15_02_01,measure,0.0,,,Share of public pharmaceutical expenditures in total pharmaceutical expenditures (%)
MEDS0_0_0,measure,0.0,,,Generic
MEDS8_01_12_01,measure,0.0,,,AMR strategy has been updated in 2010 or later
MEDS8_01_01,measure,0.0,,,Essential medicines list exists
NUTOVERWEIGHTPREV,measure,182.0,region,number,Overweight prevalence
NUTOVERWEIGHTNUM,measure,182.0,region,number,Overweight numbers (in millions)
NUTSEVWASTINGPREV,measure,210.0,region,number,Severe wasting prevalence
NUTSEVWASTINGNUM,measure,210.0,region,number,Severe wasting  numbers (in millions)
NUTSTUNTINGPREV,measure,222.0,region,number,Stunting prevalence
NUTSTUNTINGNUM,measure,222.0,region,number,Stunting  numbers (in millions)
NUTUNDERWEIGHTPREV,measure,182.0,region,number,Underweight prevalence
NUTUNDERWEIGHTNUM,measure,182.0,region,number,Underweight  numbers (in millions)
NUTWASTINGPREV,measure,210.0,region,number,Wasting prevalence
NUTWASTINGNUM,measure,210.0,region,number,Wasting  numbers (in millions)
RHR_IPV,measure,102.0,region,number,Intimate partner violence prevalence among ever partnered women (%)
RHR_NPSV,measure,29.0,region,number,Non-partner sexual violence prevalence (%)
ORGANPOP,measure,0.0,,,Population (millions)
ORGANKIDNEYNUM,measure,0.0,,,Kidney transplants (absolute number)
ORGANKIDNEYRATE,measure,0.0,,,Kidney transplants (per million)
ORGANLIVERNUM,measure,0.0,,,Liver transplants (absolute number)
ORGANLIVERRATE,measure,0.0,,,Liver transplants (per million)
ORGANTOTALNUM,measure,0.0,,,Total organs transplanted (absolute number)
ORGANTOTALRATE,measure,0.0,,,Total organs transplanted (per million)
ORGANTOTALDECNUM,measure,0.0,,,Total actual deceased donors (absolute number)
ORGANTOTALDECRATE,measure,0.0,,,Total actual deceased donors (per million)
M_Group,measure,776.0,country,number,Monitor
P_Group,measure,776.0,country,number,Protect from tobacco smoke
O_Group,measure,776.0,country,number,Offer help to quit tobacco use
W_Group,measure,776.0,country,number,Warn about the dangers of tobacco
W-MM_Group,measure,776.0,country,number,Anti-tobacco mass media campaigns
E_Group,measure,776.0,country,number,Enforce bans on tobacco advertising
R_Group,measure,776.0,country,number,Raise taxes on tobacco
M_Est_tob_curr,measure,582.0,country,number,Current smoking of any tobacco product (age-standardized rate)
M_Est_tob_daily,measure,582.0,country,number,Daily smoking of any tobacco product (age-standardized rate)
M_Est_cig_curr,measure,582.0,country,number,Current smoking of cigarettes (age-standardized rate)
M_Est_cig_daily,measure,582.0,country,number,Daily smoking of cigarettes (age-standardized rate)
M_svy_yr_adult,measure,0.0,,,Year of survey of adults
M_survey_title_adult,measure,194.0,country,str,Name of survey of adults
M_svy_national_adult,measure,194.0,country,str,Representativeness of survey of adults
M_svy_age_adult,measure,194.0,country,str,Adult survey age range
M_def_1_text_adult,measure,194.0,country,str,Adult indicator 1 definition
M_def_1_prev_adult,measure,582.0,country,number,Adult indicator 1 rate
M_def_2_text_adult,measure,194.0,country,str,Adult indicator 2 definition
M_def_2_prev_adult,measure,582.0,country,number,Adult indicator 2 rate
M_smkless_svy_yr_adult,measure,0.0,,,Year of survey of adults - smokeless
M_smkless_survey_title_adult,measure,85.0,country,str,Name of survey of adults - smokeless
M_smkless_svy_national_adult,measure,85.0,country,str,Representativeness of survey of adults - smokeless
M_smkless_age_range_adult,measure,85.0,country,str,Adult survey age range - smokeless
M_smkless_def_text_adult,measure,194.0,country,str,Adult smokeless tobacco use indicator definition
M_smkless_prev_adult,measure,563.0,country,number,Adult smokeless tobacco use indicator rate
M_svy_yr_youth,measure,0.0,,,Year of survey of youth
M_survey_title_youth,measure,189.0,country,str,Name of survey of youth
M_svy_national_youth,measure,189.0,country,str,Representativeness of youth survey
M_svy_age_youth,measure,189.0,country,str,Youth survey age range
M_def_1_text_youth,measure,189.0,country,str,Youth indicator 1 definition
M_def_1_prev_youth,measure,567.0,country,number,Youth indicator 1 rate
M_def_2_text_youth,measure,157.0,country,str,Youth indicator 2 definition
M_def_2_prev_youth,measure,471.0,country,number,Youth indicator 2 rate
M_smkless_svy_yr_youth,measure,0.0,,,Year of survey of youth - smokeless
M_smkless_survey_title_youth,measure,103.0,country,str,Name of survey of youth - smokeless
M_smkless_svy_national_youth,measure,103.0,country,str,Representativeness of survey of youth - smokeless
M_smkless_age_range_youth,measure,103.0,country,str,Youth survey age range - smokeless
M_smkless_def_text_youth,measure,194.0,country,str,Youth smokeless tobacco use indicator definition
M_smkless_prev_youth,measure,582.0,country,number,Youth smokeless tobacco use indicator rate
P1_healthcare,measure,776.0,country,str,Health-care facilities (national legislation)
P2_education,measure,776.0,country,str,Education facilities except universities (national legislation)
P3_universities,measure,776.0,country,str,Universities (national legislation)
P4_govt,measure,776.0,country,str,Government facilities (national legislation)
P5_indoor_off,measure,776.0,country,str,Indoor offices (national legislation)
P6_restaurants,measure,776.0,country,str,Restaurants (national legislation)
P7_pubs,measure,776.0,country,str,Pubs and bars (national legislation)
P8_pub_transp,measure,776.0,country,str,Public transport (national legislation)
P9_all_other,measure,776.0,country,str,All other indoor public places (national legislation)
PC_sfe_compliance,measure,776.0,country,number,Compliance with regulations on smoke-free environments (national legislation)
P_count_places_sf,measure,776.0,country,number,Number of places smoke-free (national legislation)
P11_fines_any,measure,776.0,country,str,Fines for violations
P12_fines_establishment,measure,776.0,country,str,Fines on the establishment
P13_fines_smoker,measure,776.0,country,str,Fines on the patron
P14_funds_for_enforce,measure,776.0,country,str,Dedicated funds for enforcement
P15_complaints,measure,776.0,country,str,Citizen complaints and investigations
P10_subnat_auth_exists,measure,776.0,country,str,Subnational smoke-free legislation authority exists
P_subnat_complete_ban_exists,measure,0.0,,,Comprehensive bans in place subnationally
O_Quitline,measure,776.0,country,str,Access to a toll-free quit line
O_Avail_hosp,measure,776.0,country,str,Treatment for tobacco dependence available in hospitals
O_Ins_hosp,measure,776.0,country,str,Treatment for tobacco dependence in hospitals cost covered
O_Avail_hlthSPACEclin,measure,0.0,,,Treatment for tobacco dependence available in health clinics or other primary care facilities
O_Avail_off_hlth_prof,measure,776.0,country,str,Treatment for tobacco dependence available in offices of health professionals
O_Ins_off_hlth_prof,measure,776.0,country,str,Treatment for tobacco dependence in offices of health professionals cost covered
O_Avail_community,measure,776.0,country,str,Treatment for tobacco dependence available in the community
O_Ins_community,measure,776.0,country,str,Treatment for tobacco dependence in the community cost covered
O_Avail_other,measure,776.0,country,str,Treatment for tobacco dependence available in other settings
O_Ins_other,measure,776.0,country,str,Treatment for tobacco dependence in other settings cost covered
O_NRT_sold,measure,776.0,country,str,Nicotine replacement therapy - legally sold
O_NRT_where,measure,776.0,country,str,Nicotine replacement therapy - place available
O_NRT_ins,measure,776.0,country,str,Nicotine replacement therapy - cost covered
O_NRT_EML,measure,776.0,country,str,Nicotine replacement therapy on the Essential Medicines List
O_Bup_sold,measure,776.0,country,str,Bupropion - legally sold
O_Bup_where,measure,776.0,country,str,Bupropion - place available
O_Bup_ins,measure,776.0,country,str,Bupropion - cost covered
O_Varen_sold,measure,776.0,country,str,Varenicline - legally sold
O_Varen_where,measure,776.0,country,str,Varenicline - place available
O_Varen_ins,measure,776.0,country,str,Varenicline - cost covered
W1_HW_law_A,measure,776.0,country,str,Law mandates that health warnings appear on tobacco packages
W2_pc_front_back_A,measure,776.0,country,number,Percentage of principal display area mandated to be covered by health warnings - front and back of cigarette packaging
W3_pc_front_A,measure,776.0,country,number,Percentage of principal display area mandated to be covered by health warnings - front of cigarette packaging
W4_pc_back_A,measure,776.0,country,number,Percentage of principal display area mandated to be covered by health warnings - back of cigarette packaging
W15_specific_hw_A,measure,776.0,country,str,Does the law mandate specific health warnings on cigarette packaging?
W16_number_hw_A,measure,776.0,country,number,How many health warnings are approved by the law for cigarette packaging?
W11_outside_pack_A,measure,776.0,country,str,Do health warnings appear on each cigarette package and any outside packaging and labelling used in the retail sale?
W14_harm_effects_A,measure,776.0,country,str,Do health warnings on cigarette packaging describe the harmful effects of tobacco use on health?
W6_font_A,measure,776.0,country,str,"Does the law mandate font style, font size and colour of health warnings on cigarette packaging?"
W7_rotation_A,measure,776.0,country,str,Are the health warnings on cigarette packaging rotating?
W8_princ_langs_A,measure,776.0,country,str,Are the health warnings on cigarette packaging written in the principal language(s) of the country?
W10_graphic_A,measure,776.0,country,str,Do the health warnings on cigarette packaging include a photograph or graphic?
W5_top_side_A,measure,776.0,country,str,Health warnings on cigarette packaging must be placed at the top of the principal display areas of the package
W13_ind_liability_A,measure,776.0,country,str,Health warnings on cigarette packaging do not remove or diminish the liability of the tobacco industry
W12_imports_dutyfree_A,measure,776.0,country,str,Health warnings on cigarette packaging law applys to products whether manufactured domestically imported AND for duty-free sale
W9_no_obscure_A,measure,776.0,country,str,Health warnings on cigarette packaging must not be obscured in any way including by required markings such as tax stamps
W17_fines_A,measure,776.0,country,str,Health warnings on cigarette packaging law requires or establishes fines for violations
